{
  "kind": "world_os_codex_brain_run_receipt",
  "contractVersion": "0.1.0",
  "brainRunId": "brain-run.example",
  "version": 1,
  "implementationVersion": "0.4.0",
  "workspaceRef": { "kind": "world_os_workspace", "id": "workspace.world-matrix", "version": 1, "contentHash": "sha256:0000000000000000000000000000000000000000000000000000000000000000" },
  "worldIds": ["W01", "W02"],
  "maxCycles": 10,
  "simulationPolicy": "weighted_fair_deficit_round_robin",
  "llmMode": "disabled",
  "mcpMode": "dry_run",
  "startedAt": "2026-08-24T08:00:00.000Z",
  "endedAt": "2026-08-24T08:05:00.000Z",
  "writer": { "kind": "codex", "id": "codex.root" },
  "portfolioRunRef": { "kind": "world_os_portfolio_run_receipt", "id": "portfolio-run.example", "version": 1, "contentHash": "sha256:0000000000000000000000000000000000000000000000000000000000000000" },
  "shadowRunRefs": [],
  "shadowFailureCount": 0,
  "dispatch": {
    "status": "dry_run",
    "profileRefs": [{ "kind": "world_os_platform_profile", "id": "platform-profile.studio-private", "version": 1, "contentHash": "sha256:0000000000000000000000000000000000000000000000000000000000000000" }],
    "pendingProjectionRefs": [],
    "pendingCount": 0,
    "dispatchedCount": 0,
    "skippedCount": 0,
    "failureCount": 0,
    "attemptRefs": [],
    "publishReceiptRefs": []
  },
  "preflight": { "status": "pass", "artifactCount": 40, "referenceCount": 100, "missingReferenceCount": 0, "hashMismatchReferenceCount": 0, "cycleCount": 0 },
  "postflight": { "status": "pass", "artifactCount": 50, "referenceCount": 130, "missingReferenceCount": 0, "hashMismatchReferenceCount": 0, "cycleCount": 0 },
  "status": "advanced",
  "stopReason": "budget_exhausted"
}
